{
  "schema_version": "2.0",
  "match_id": "MOCK-TC-008",
  "round_no": 5,
  "source_video": {
    "path": "mock/TC-008.mp4",
    "fps": 60,
    "width": 1920,
    "height": 1080,
    "duration_sec": 120
  },
  "round_window": {
    "start_sec": 0,
    "end_sec": 100
  },
  "round_meta": {
    "side": "attack",
    "map": "Ascent",
    "player_agent": "Omen",
    "round_result": "unknown",
    "score_before": {
      "ally": 4,
      "enemy": 4
    },
    "player_role": "controller",
    "economy_context": null
  },
  "observation_quality": {
    "hud_confidence": 0.98,
    "visual_confidence": 0.98,
    "timeline_completeness": 1.0,
    "missing_intervals": []
  },
  "events": [
    {
      "event_id": "TC-008-E01",
      "time_sec": 40,
      "type": "spike_planted",
      "actor": "player",
      "attributes": {
        "site": "A"
      },
      "confidence": 0.98
    },
    {
      "event_id": "TC-008-E02",
      "time_sec": 45,
      "type": "position_change",
      "actor": "player",
      "attributes": {
        "from": "A Site",
        "to": "A Main Post",
        "line_of_sight_to_spike": true,
        "cover_available": true
      },
      "confidence": 0.98
    }
  ],
  "state_snapshots": [
    {
      "time_sec": 42,
      "ally_alive": 3,
      "enemy_alive": 2,
      "hp": 100,
      "armor": 50,
      "weapon": "Vandal",
      "spike_state": "planted",
      "round_time_remaining_sec": null,
      "utility_available_count": null,
      "player_location": {
        "zone_id": "ascent_a_site",
        "zone_name": "A Site",
        "map_x_norm": null,
        "map_y_norm": null
      },
      "known_enemy_locations": [],
      "spatial_context": {
        "cover_available": true,
        "escape_route_available": null,
        "line_of_sight_state": "confirmed_clear",
        "exposed_directions_count": null,
        "view_target_zone_id": null
      },
      "source_confidence": {
        "ally_alive": 0.98,
        "enemy_alive": 0.98,
        "weapon": 0.98,
        "spike_state": 0.98,
        "player_location": 0.98,
        "spatial_context": 0.98
      }
    },
    {
      "time_sec": 46,
      "ally_alive": 3,
      "enemy_alive": 2,
      "hp": 100,
      "armor": 50,
      "weapon": "Vandal",
      "spike_state": "planted",
      "round_time_remaining_sec": null,
      "utility_available_count": null,
      "player_location": {
        "zone_id": "ascent_a_main",
        "zone_name": "A Main",
        "map_x_norm": null,
        "map_y_norm": null
      },
      "known_enemy_locations": [],
      "spatial_context": {
        "cover_available": true,
        "escape_route_available": null,
        "line_of_sight_state": "confirmed_clear",
        "exposed_directions_count": null,
        "view_target_zone_id": null
      },
      "source_confidence": {
        "ally_alive": 0.98,
        "enemy_alive": 0.98,
        "weapon": 0.98,
        "spike_state": 0.98,
        "player_location": 0.98,
        "spatial_context": 0.98
      }
    }
  ],
  "frames": [],
  "previous_round_context": null,
  "deterministic_facts": [
    {
      "fact_id": "F001",
      "key": "side",
      "value": "attack",
      "time_sec": null,
      "time_range": null,
      "confidence": 1.0,
      "source": "config",
      "provenance_event_ids": []
    },
    {
      "fact_id": "F002",
      "key": "player_role",
      "value": "controller",
      "time_sec": null,
      "time_range": null,
      "confidence": 1.0,
      "source": "config",
      "provenance_event_ids": []
    },
    {
      "fact_id": "F003",
      "key": "numbers_state",
      "value": "advantage",
      "time_sec": 42,
      "time_range": null,
      "confidence": 0.99,
      "source": "derived_code",
      "provenance_event_ids": []
    },
    {
      "fact_id": "F004",
      "key": "weapon",
      "value": "Vandal",
      "time_sec": 42,
      "time_range": null,
      "confidence": 0.98,
      "source": "hud",
      "provenance_event_ids": []
    },
    {
      "fact_id": "F005",
      "key": "spike_carried_by_player",
      "value": false,
      "time_sec": 42,
      "time_range": null,
      "confidence": 0.98,
      "source": "derived_code",
      "provenance_event_ids": []
    },
    {
      "fact_id": "F006",
      "key": "spike_planted",
      "value": true,
      "time_sec": 42,
      "time_range": null,
      "confidence": 0.98,
      "source": "derived_code",
      "provenance_event_ids": []
    },
    {
      "fact_id": "F007",
      "key": "spatial_context_available",
      "value": true,
      "time_sec": 42,
      "time_range": null,
      "confidence": 0.95,
      "source": "derived_code",
      "provenance_event_ids": []
    },
    {
      "fact_id": "F008",
      "key": "cover_available",
      "value": true,
      "time_sec": 42,
      "time_range": null,
      "confidence": 0.9,
      "source": "visual",
      "provenance_event_ids": []
    },
    {
      "fact_id": "F009",
      "key": "line_of_sight_state",
      "value": "confirmed_clear",
      "time_sec": 42,
      "time_range": null,
      "confidence": 0.9,
      "source": "visual",
      "provenance_event_ids": []
    },
    {
      "fact_id": "F010",
      "key": "zone_id",
      "value": "ascent_a_site",
      "time_sec": 42,
      "time_range": null,
      "confidence": 0.9,
      "source": "visual",
      "provenance_event_ids": []
    },
    {
      "fact_id": "F011",
      "key": "numbers_state",
      "value": "advantage",
      "time_sec": 46,
      "time_range": null,
      "confidence": 0.99,
      "source": "derived_code",
      "provenance_event_ids": []
    },
    {
      "fact_id": "F012",
      "key": "weapon",
      "value": "Vandal",
      "time_sec": 46,
      "time_range": null,
      "confidence": 0.98,
      "source": "hud",
      "provenance_event_ids": []
    },
    {
      "fact_id": "F013",
      "key": "spike_carried_by_player",
      "value": false,
      "time_sec": 46,
      "time_range": null,
      "confidence": 0.98,
      "source": "derived_code",
      "provenance_event_ids": []
    },
    {
      "fact_id": "F014",
      "key": "spike_planted",
      "value": true,
      "time_sec": 46,
      "time_range": null,
      "confidence": 0.98,
      "source": "derived_code",
      "provenance_event_ids": []
    },
    {
      "fact_id": "F015",
      "key": "spatial_context_available",
      "value": true,
      "time_sec": 46,
      "time_range": null,
      "confidence": 0.95,
      "source": "derived_code",
      "provenance_event_ids": []
    },
    {
      "fact_id": "F016",
      "key": "cover_available",
      "value": true,
      "time_sec": 46,
      "time_range": null,
      "confidence": 0.9,
      "source": "visual",
      "provenance_event_ids": []
    },
    {
      "fact_id": "F017",
      "key": "line_of_sight_state",
      "value": "confirmed_clear",
      "time_sec": 46,
      "time_range": null,
      "confidence": 0.9,
      "source": "visual",
      "provenance_event_ids": []
    },
    {
      "fact_id": "F018",
      "key": "zone_id",
      "value": "ascent_a_main",
      "time_sec": 46,
      "time_range": null,
      "confidence": 0.9,
      "source": "visual",
      "provenance_event_ids": []
    },
    {
      "fact_id": "F019",
      "key": "spike_planted",
      "value": true,
      "time_sec": 40,
      "time_range": null,
      "confidence": 0.98,
      "source": "event_normalization",
      "provenance_event_ids": [
        "TC-008-E01"
      ]
    }
  ]
}